narrative,product,risk_label
received letter chase mortgage executive director regarding mortgage transferred fraud rogue mortgage company collection agency one point chase twice talked phone case manager escalation dept representative twice escalation dept poc regarding rogue company disdain transferred company complaint several hundred complaint site chase provided incorrect escrow statement would send updated paperwork correct figure mortgage payment increased significantly given error given issue intentionally creates customer wanted everything corrected writing transferred wanted opportunity see correction refused contacted homeowner insurance company decrease homeowner insurance well given automatic increase need increased mortgage payment well said information updated homeowner insurance payment faxed case manager locate name contact information said information could sent everything else transferred however communication chase helpful regarding said mortgage transferred chase home see anything contract authorize transfer especially company hundred hundred complaint regarding illegal practice include fraudulent behavior action towards customer include illegal escrow activity stealing money applying payment correctly fee fraud profit violate respa regulation contacted chase twice ask would transfer loan reputable fair company received answer online inquiry could see told via phone chase escalation dept representative phone ext chase prerogative transfer loan recorded conversation need copy said conversation reference escrow analysis new payment information referenced respa transfer loan rogue fraud profit company like additionally chase per chase escalation dept provided incorrect escrow analysis increased mortgage payment added additional school tax supposed estimate referenced analysis added erroneously mortgage payment increased chase stated escrow analysis would corrected since chase fault sent new payment per escalation department escrow balance instead correction never made chase doesnt need information correct mortgage payment homeowner insurance also increased decreased per request information sent chase said homeowner insurance also affect mortgage payment amount said information sent chase need forward said information ensure someone actually receives habit rogue activity debt collector per recording turned mortgage servicer also predatory lender fraud profit organization need chase correct escrow analysis promised send corrected information new servicer asap actual preference transferred reputable servicer speaking chase executive office ext heard complaint fell deaf ear individual argued instead attempting assist concern quoted normal law mortgage servicers right transfer loan communicated loan transferred rogue fraud profit company like fbi list company company heavily investigate shut chase business company actually predatory lender puzzling placing loyal customer jeopardy losing home contacted twice first time couldnt get anyone second time called chase representative name helpful soon understood per phone conversation worst per statement even though beginning stage working help solidify numerous complaint read website numerous reputable site stayed hold minute assisted able speak supervisor explain escrow issue made chase stated mortgage payment amount file loan also stated would honor forbearance placed chase mortgage payment would due starting however stated never received forbearance paperwork chase document need sent chase asap conversation continued supervisor hung u disconnected never called back another complaint referenced others online seems helpful first nothing want issue escalated executive office well ensure servicing loan stay within law remains chase without padding escrow remains without fraud profit predatory activity attached complaint found complaint fraud profit scam related activity complaint found http hundred complaint regarding site well unusual know company get complaint illegal related complaint acting unlawfully getting away activity need properly addressed stopped look like need shut please help usda loan veteran medical leave without pay single mother college student need mortgage transferred back chase reputable company long history bad customer service stealing money consumer signing processing insurance check payment home repair due damage applying payment properly erroneous fee rogue escrow activity includes increased fee reason dishonest effort responding complaint consumer applying payment properly charging customer additional fee mistake made intentionally replying customer mostly untrue reply said reply didnt address customer concern usda loan contacted md attorney general usda fbi etc please help placed forbearance chase prior due medical leave without pay forbearance go chase loan number loan number,mortgages_and_loans,high
reached via phone email amerihome mortgage inquire loan payment processing specifically inquiring loan payment applied higher amount interest outlined explanation amount due past month explanation reason monthly statement recall receiving correspondence received automatic reply institution received phone call resolution,mortgages_and_loans,low
obtained loan fsst financial service dba rushmore financial south dakota california assembly bill passed put cap loan rushmore charging paid back date according paperwork monthly payment rate would would pay,mortgages_and_loans,low
received letter penfed credit union stating increasing interest rate loan approximately failure provide title collateral loan penfed refinanced auto loan paid loan called penfed told title would contact see year financing car never chase title told would hold increasing interest rate day chased title spoke contacted stated title sent penfed called penfed back got new customer service person told needed copy driver license told uploaded month ago operator operator id helpful pulled submission found driver license told supervisor put high important email collateral already driver license file would resolved collateral also stated contact anything needed actual title need worry compliant regard bank able increase interest rate collateralized loan needed copy driver license especially uploaded copy driver license failure review document clearly showed received system would caused auto loan payment jump per month per month error provided explanation needed copy color driver license requirement obtaining new loan require prior giving auto loan first place,mortgages_and_loans,low
described problem detail pdf file attached complaint summary well fargo denying access credit believe trying steer mortgage foreclosure process filing complaint realize listed loan number account number attached documentation may serve correction,mortgages_and_loans,low
happened earnin took dollar account money bank account made become drawn refusing let cash dollar make account good,mortgages_and_loans,low
filed bankruptcy home equity line credit u bank reaffirmed mortgage reaffirmation agreement filed court monthly payment continued automatically withdrawn checking account month however heloc longer showing online receiving monthly statement bankruptcy discharged thought would begin receiving statement heloc called u bank find would able see heloc online could get statement confirmed bankruptcy show discharged know status updated transferred different people told different thing said sure heloc status updated transferred told would get statement would show online told reaffirmation agreement file needed contact lawyer filed last person talked bankruptcy department said would send statement show heloc online day bankruptcy termination date would contact lawyer said could give current balance tell payment history said show payment since even though continued take payment checking account month concerned getting credited payment made balance going accruing interest balance already paid towards way verify heloc balance interest payment refuse help,mortgages_and_loans,high
writing today resolve ally bank account related totaled vehicle insured checking issued ally check b unpaid balance subsequently paid gap insurance though extensive effort ally received safe guard check told employee back dated ally bank utilize check monthly payment thus showing continued payment loan last payment ally ally file gap insurance payment something responsible ally show incorrect balance account paid without late payment spoke ally many time trying resolve issue deployed subsequently email executive officer director ally financial response contacted three credit reporting agency supporting evidence ally subsequently place higher balance account causing credit score drop several point ally currently two separate account credit profile showing charged showing late payment one account ally bank b together two account ruined credit seven year,mortgages_and_loans,high
buyer buying agent first home florida supposed close property fha mortgage using lender outsourced underwriting mortgage solution colorado subsequently informed u would take another month close property already extended deal week swapped lender friend mine file underwritten week however need fha case number appraisal transferred old underwriter old underwriter using taken another week respond u question time limit transfer appraisal fha case number even swapped lender old lender still holding closing wo transfer case number obviously lot riding home closing school furniture lease ending soon live currently face losing escrow deposit money old lender wo timely transfer fha case number facing serious damage deadline extension close original closing date,mortgages_and_loans,low
company involved behalf mortgage agfirst address company xxxxxxxx va mortgage home sold requested payoff statement good attorney closed sale sent check address via usp overnight tracking number delivered va week delivery attorney notified check still cleared began making contact multiple time getting anywhere stated received check package started complaint customer service rep said account research would make payment charged interest attorney thought resolved got notification credit score dropped also charged interest account account paid called attorney said finally got someone asking hr department finally said received package check inside believe lie attorney cancelled check agreed wire money account paid however want get rid mark credit refusing pay interest think company highly unprofessional handling large sum money,mortgages_and_loans,high
due financial impact virus pandemic wesbanco bank solicited offer mortgage holder certain qualification defer mortgage principle interest payment month solicitation sent via email last week include detail pertaining program encouraged recipient call information upon contacting bank inquire program given statement month deferred principle interest payment phone conversation included statement payment would added final payment loan maturity balloon payment payment required relief period would required escrow payment point would appear based statement made loan maturity one would making payment equal scheduled payment supported cover letter accompanying contract signature included document attachment wherein one see mention interest accrual statement made however deferred payment added final payment term note causing balloon payment due maturity date contract presented signature bank reveal interest continue accrue relief period added final balloon payment neglecting reveal beginning deceptive opinion intentional bank hoping consumer read final contract consumer financial distress option agree term predatory tactic provide relief borrower serf line pocket lender would encourage consumer financial protection bureau part stop predatory tactic time financial hardship many country fortunate option disposal although month deferral would greatly appreciated many others lucky may choice commit financial burden could potentially result future loss home able fulfill obligation extraordinary balloon payment loan maturity,mortgages_and_loans,low
company blatantly violating advertising rule set forth regulation z unfortunate regulator clamped lender area written violation yet company like regulated cfpb allowed willfully deceive customer based rate offered show absolute travesty allowed pray lower income borrower showing fha loan product even required disclosure loan officer half abide rule subject disciplinary action company yet company like ruin reputation mortgage lender apparent compliance management system company matter wish regulated fdic federal reserve could get ground unfair practice willful violation compliance culture organization question since abide rule mention information provided least two lender accurate willfully misrepresent disclosure compare product deceives potential customer,mortgages_and_loans,low
never received loan check n go never sudden month checked credit score report seen collection check n go never applied loan received money point im pretty certain fraud app show month month weird reported collection month tried dispute twice wont take im trying find alternative get credit knowing didnt apply got money right fair credit didnt victim identity theft hope pray another incident,mortgages_and_loans,high
unfair deceptive advertising loan officer quicken loan advertising free loan,mortgages_and_loans,low
company ignored several inquiry request forbearance,mortgages_and_loans,low
closed refinance paid old mortgage nearly escrow account old mortgage based applicable government regulation escrow balance returned borrower within calendar day payoff called old mortgage company confirm phone representative confirmed receive escrow refund check mail however received payment,mortgages_and_loans,low
citizen one home loan granted covid forbearance end payment deferral resumed mortgage payment directed yet system updated covid forbearance information reported delinquent brought credit score told past due amount added end mortgage would due maturity government program customer told would affect credit reporting customer delinquent program end,mortgages_and_loans,low
submitted application fee amerisave mortgage order refinance mortgage better rate paid fee competed application process loan officer stopped communicating phone little phone communication officer kept telling loan percent complete need anything else would get email request insurance document document requested confusing unfamiliar would call ask question would answer phone return call finally speak would say need anything else ignore request document often speaking would get email assistant asking document told need went week responded never spoke answered question think robo spoken told ignore document request tired going around circle document wanted would answer question right loan status changed cancelled without explaination lost application fee uncooperative finance company amerisave mortgage unethical thief,mortgages_and_loans,low
asked home point mortgage forbearance home loan day went homepoint financial webpage tried pay take forbearance thought made supposed call someone hpf thought done went make sure autopay found payment didnt go id made payment hpf marking day late mortgage mean credit score dropped point get another mortgage least year governor proclaimed mortgage company would report people late ive called company written letter credit report im asking anyone forbearance lender report late thank,mortgages_and_loans,medium
submitted complaint numerous bill collector call mortgage pay mortgage every month via bill pay payment cashed applied suspense account unspecified account payment applied escrow mortgage appears mortgage default company running scam doubt predatory lender begin charge default interest home started took home loan said owed additional escrow could never tell came agree escrow payment modified year usually couple dollar less discrepancy appears amount tax payment possible specialized loan servicing paid tax due month loan acquisition company must investigated predatory lending practice fixed income scared death company begin foreclosure primary home please help,mortgages_and_loans,high
negotiated refinance loan chase mortgage getting figure asked good faith deposit couple day later changed term financincing disputed charge wont give agent told phone misrepresented value home never gave record call asked proof refused victim classic bait switch need amount dollar understanding part contract changed party must agree,mortgages_and_loans,low
used auto loan capital one finance given never late loan delinquent vehicle totaled drunk driver overnight deemed total loss insurance expedited payment lender along left fund extended warranty plan lender upon receiving lump sum lender decided apply dollar loan towards interest remaining amount towards principal balance left balance due loan agreed pay remaining balance around dollar needed paid later told would able get another car loan despite balance left although may may capital one auto finance applied loan next month could get offer lender capital one still reporting lender collateral whole loan amount instead remaining balance called ask representative told full balance paid capital one right report original loan amount credit bureau see fit known would paid whole balance completely account paid full since lender still reported updated information since still unable get loan anything rolled another car loan incorrect reporting believe lender spiteful situation suppose make lot money fault vehicle got destroyed corona virus hit country full pace thing started get shut know future employment took advantage hardship offered time still able work keep payment going since applied hardship capital also reported applied another auto loan also lender unfair consumer never take another product capital one last bank earth worst ive treated financial institution life ive made payment time never gave capital one issue,mortgages_and_loans,low
made extra payment may loan principal payment applied principal several extra payment automatically allocated late fee ally electronic payment system automatically allocates fund first payment second outstanding fee third principal ally policy state customer may request payment fund applied principal called emailed ally first time occurred stated would like payment allocated principal chose paying principal faster allows less interest finance charge time called ally would reallocated portion amount late fee principal process would also take long reallocation would cross another payment would call get payment allocated late fee principal ally would allocate less amount allocated stand ally applied account fund removed late fee reallocated account,mortgages_and_loans,medium
well fargo nothing lying got proof insurance want mediation ai asked month iwant,mortgages_and_loans,low
received envelope tenant addressed occupant notice action foreclosure property occupy learned home purchased tax lien late xxxxxxxx sold home loan newrez mortgage company hereinafter referred newrez learned via research tax due county md annually respectively paid half period one year newrez purchased mortgage loan assumed instead vetting proper quality assurance process date paid tax newrez paid tax amount assuming payment half year payment full attachment line item dated tax bill disbursement assuming property tax account current sent surplus check amount attachment line item dated surplus disbursement thorough review account otherwise would vetted property tax prior surplus disbursement visited spoke county tax office financial supervisor matter provided information regarding entire process tax lien tax sale property delinquent tax according latter case county accept payment forward prior year delinquent tax debt full additionally payment made tax office legal court administrative fee paid full case payment would made legal court administrative fee attachment attachment respectively email invoice tax property fully paid county tax office refused tax payment newrez county notified newrez delinquent tax debt dating back informed payment full would need received could accept tax payment county refused acceptance tax payment newrez instead sent surplus check amount since able pay first half tax attachment line item dated surplus disbursement make attempt correct outstanding tax debt attempt make additional tax payment calendar year well notified tax discrepancy county position surplus check mailed appears finally house purchased tax tax payment received county result delinquent tax due year made first phone call newrez received notice foreclosure envelope tenant inquired status mortgage account never late payment informed phone representative sued assured whatever received must error account current never delinquent studied package lawsuit carefully weekend phoned newrez spoke phone representative told sent check amount didnt know know stated account note indicated special payment sent information provided note emailed copy delinquent tax bill dating back received county tax office supervisor also emailed entire lawsuit maryland day phoned back told representative although receipt email package attachment would business day someone would follow regarding content email suspense date additional interest penalty would assessed onto delinquent tax account followed phoned newrez spoke newrez phone representative informed note reflected escalation account party providing payment tax office behalf respective mortgage company couldnt see issue escalation account occurred information wasnt provided note phone representative level according spoke county tax office day informed appears behalf newrez something account tickler deadline date happened due date next monetary interest penalty would assessed property tax account followed several time newrez time got run high level manager informed account fine house sold tax lien house never foreclosure newrez never received email paperwork previously verified prior week paperwork email attachment indeed received never sued didnt even know didnt understand talking etc spoke first line supervisor following day confirmed indeed payment made didnt understand admit appeared something going account end result conversation someone would call back information never received phone call confirmed county tax office following week account paid provided receipt via email attachment county property tax receipt attachment county property tax receipt attachment xxxxl county tax receipt early also followed office via email legal court administrative fee paid office newrez assistant provided receipt well attachment legal court administrative fee paid request property redemption release court date scheduled noted filed motion dismiss case motion dismiss granted prejudice attachment circuit court maryland case information received certificate redemption freeing home sale process tax lien attachment certificate redemption newrez present day still remains steadfast claim home never foreclosure account always current regarding payment tax anticipated would append interest penalty court administrative legal fee escrow account ive least conversation first line phone representative promise someone account office would return phone call call never happened however one conversation representative young lady passive aggressive telling name cartoon character name learned following day name made request escalation eventually received letter dated attachment newrez dba business shellpoint mortgage thanking providing past due statement informing made payment follows without explanation provided administrative fee tax tax tax tax tax total tax cost including interest penalty additionally letter mention payment made acknowledge delinquent property tax interest penalty paid buyer home tax lien also acknowledge address lawsuit sale court date stated tax paid paid total amount explained nothing normal tax year approximately county md attachment turned,mortgages_and_loans,high
rewrez loan balance loan credit report reported balance writing mortgage companying correct credit come refused keep credit low also reported forbearance month writing correct mortgage company refused refinance process credit gone mistake deliberate act make impossible get loan approval refinancing,mortgages_and_loans,low
refi mortgage cash pay loan assessed county tax reduced county property tax bill money source would adjust escrow since could verify information fact fast forward tm pay tax bill first available claim even though collecting escrow pay insurance account set escrow pay county tax therefor tax paid late thankfully paid penalty however issued showing issued county essentially paying tax bill twice claiming owe money due shortage escrow account reality need recover fund back county issue correct escrow shortage,mortgages_and_loans,low
