narrative,product,risk_label
pnc point visa pnc bank credit card xxxxxxxxxxxxxxxx balance limit tried closing account balance never allowed close problem person used credit card help close account even repeatedly asked close say take action try jacking credit card even,credit_card,low
morning received phone call time et et synchrony bank sleeping answer also going get taken care however know called many time one minute harassment thank time,credit_card,medium
received amex serve card prior covid stimulus check sent activated heard check going soon attempted activate card subsequently locked account security purpose kept directed website call automated service activate card nowhere automated menu option activate card spent hour hold trying reach human one evening call simply rejecting new call hanging way accessing account information without first activating card even though already set american express serve account want use card want transfer money actual bank account,credit_card,low
complaint relates violation cfpb regulation regarding allocation payment expiring promotional balance link applicable regulation http b relevant credit card issuer citibank na balance two different promotional offer credit card statement balance apr offer expiring balance apr offer expiring made payment credit card intention clearing balance scheduled expiration however upon receiving statement became clear payment largely applied towards offer expiring violation referenced cfpb regulation result incorrect allocation balance transferred standard purchase corresponding interest rate starting incur high interest charge statement contacted citibank na customer service phone resolve issue initial response well allocate payment informed allocation violation federal regulation told would escalated supervisor would call back receive call back several week upon made follow call told matter still investigation nothing happened another week received letter citibank dated stating request payment allocation denied attached following supporting document statement statement statement citibank letter denial dated,credit_card,low
received email checking account bank indicating account overdrafted saw bank america took called bank america asked payment amount told accidentally set automatic payment due date previous account balance requested payment sent back checking account monday called see going refund told request system would take business day process called monday get update told amount refunded transaction needed approved fraud department called later week informed fraud department approved refund told would take another business day refund would process back checking account called approximately time check refund yet posted account asked speak manager several occasion told someone call never received call return also began noticing every time called would disconnected call would fail got point would call row disconnected different stage call monday called spoke bank america confirmed refund approved activity account process refund since assisted submitting complaint bank america told manager would call back follow processing refund never received phone call back wednesday called told different associate refund still looked never approved sorry whoever misinformed asked speak manager called failed yet called different phone number able finally speak service member named florida asked could point boa policy explains refund process unable find boa website also unable provide kind written documentation either confirming refund explaining process finally able get clear answer refund could take additional business day refund top usual business day told expect refund latest,credit_card,low
prepaid vacation friend period due confusion payment credited rebilled effective date attached copy original reservation confirmation copy payment however arrived could find evidence payment system demanded make full payment would allow entire party stay provided staff evidence full payment form reservation confirmation copy chase credit card statement showing payment refused honor reservation immediately called chase could resolve issue chase representative spoke directly hotel representative let know fact pay full amount entire stay hotel representative repeated never received payment despite assurance chase compromise others relying effort agreed pay one night assurance hotel staff issue would resolved next morning one night payment would either refunded credited next morning attempted confirm issue resolved front desk staff demanded pay remaining night despite effort informed would honor original reservation shockingly unable get anyone review evidence payment entire discussion chase representative never happened response front desk staff pay leave past year respectfully insisted chase customer relation team revisit charge payment processing occurred chase merchant merchant bank resolve issue refund charge amounting service never received stated credit card benefit agreement chase serious lack customer service help often time closing case without follow made open case case chase advice take merchant provided info merchant unable locate money willing refund money could locate chase unwilling talk merchant merchant bank help get resolved merchant advised email evidence request chase reverse transaction chase financially responsible error occurred internally party consumer everything supposed view breakdown internal process chase bank party transact,credit_card,low
contacted discover never received paid using discover stated never placed dispute know agent subsequently pushed dispute charge merchant received confirmation dispute promptly called freaking said would suing overturn dispute contacted discover asked help asked specifically dispute could put hold recourse could follow completing work house payment installation window back door new siding home discover overturned dispute merchant said would complete work never heard contacted discover note come work subsequently received notice intending file bankruptcy discover repeatedly said nothing help way dispute charge second time impression could chargeback stating possible even though provided documentation work ever completed email merchant directly stating wo work home still maintaining nothing never communicated would able dispute charge total paid merchant discover discover blatantly refused help additionally discover deleted evidence account message sent stating specifically never disputed anything know process falsifying evidence support refusal process dispute,credit_card,high
cease desist dispute chase card service acct ending letter response phone call letter receiving according fair debt collection practice act usc section c ceasing communication must stop communication receiving letter longer wish communicate therefore call home work cell phone location chase account responsibility allow say attempting collect debt legal obligation pay received ceasing communication letter accordance federal fair debt collection act may contact inform collection effort notify specific action taken please advised well aware right know contact company except communication confirming contact except notification specific action intend take violation fair debt collection practice act also aware contact make party concerning also violation fair debt collection practice act specifically section b regard mi,credit_card,low
capital one credit card account charged annual fee saw fee account called address issue told refund fee without canceling account agreed cancel account transferred supervisor supervisor told would lose reward associated account could check sent address asked instead value credited account told okay asked confirm money added account told conversion value reward surprised low value asked option said late already confirmed position dispute reward requires leave account open mean going charged fee feel like held credit card company bad enough going impact credit score dispute fee monetary value involved low behavior capitol one case feel predatory,credit_card,low
issue rebilled charge credit card walmart capital one failed rectify issue received correspondence capital one stating credit account interest rebilled charge credit card however seen credit besides one amount charge still credited seen yet received correspondence stating charge rebilled interest credited back havent received none lost correspondence stating cant find online profile provide proof,credit_card,low
called cancel credit card different time period day record acutal day contacted except today expressly asked cancel credit card two time talked representitive second phone call said information card cancelled said explaination would cancel card phone call supervisor said would look result phone call card still active phone call account specialist said would get card cancelled result last phone call representative said short handed would cancel card,credit_card,low
discover credit card longtime paid time always never late havent used year lie got notice saying closed called discover said needed reapply make sense wanted use could let know given chance closing account,credit_card,low
initiated fund transfer debit card transfer fund checking account wire initiated amount deducted card fund never made mybank called customer service provided automated number help contacted bank issued card could help refered back automated operator need money,credit_card,low
citi costco anywhere credit card recently received annual reward certificate redemption policy requires go costco warehouse redeem certificate someone else citi costco anywhere credit card also redeem certificate store way redeeming reward certificate expires explained citi family member underlying medical condition result see going costco store retail store year even vaccination asked citi would allow redeem certificate online purchase credit balance citi rep sympathetic insisted follow policy even admitted would visit costco store policy help costco citi maximize customer spending light pandemic refusal make reasonable accommodation outlined show firm put financial interest customer health financial wellbeing,credit_card,low
bank america unemployment fund let get money,credit_card,low
request appeal disagree outcome billing dispute amount charge posted account ive filed billing dispute amount reason dispute ive returned merchandise back merchant within return policy yet wasnt refunded reason return product ive purchased defective matrix item shipped via tracking delivered filing dispute via chase app thing system requested tracking information date item returned disclosed since havent received request additional information clearly show account notice letter section ive received letter stating dispute closed merchant favor due lack supporting information im asking chase reopen billing dispute consider document attached limited copy return request form indicating return address copy shipping label indicating recipient copy tracking information associated tracking kindly acknowledge supporting document attached credit back account kind regard,credit_card,low
customer chase credit card since around ex husband southwest freedom sapphire listed signor card one responsible paying ran plumbing company time accrued thousand point mile paid used usually weekly basis credit limit card ended taking control company card know closed balance removed user divorce recently filed bankruptcy access coordinated payment chase credit card never late missed payment damaged credit past year worked relentlessly since bought first home excellent payment history even difficult time ie divorce post divorce opened chase freedom card credit limit never missed payment late previous payment amount date listed went chase bank balance owed paid bringing balance due went store tried using card declined called customer service told account closed got home looked balance started making payment towards seen received email credit monitoring company saying chase marking account past due called customer service logged account saw fee charged chase made first minimum payment due closing non default account balance every month chase started charging late fee thursday balance paid month payment due date chase charged additional called customer service spoke id waived late fee agreement situation happening also statement accrued chase freedom unlimited reward point statement show redeemed applied account amount totaled credited total feel owe v chase handled situtation owed payment made reward credit fee waived especially due anything total due plus agreed interest since date card closed balance account reward credited including late fee covid chase also reporting credit bureau late situation right please help looking get fee resolved credit given owed intention never take responsibility amount owed chase bank loyal credible customer year,credit_card,high
chase freedom credit card opened closed company within month requested information regarding closure told due affiliate closing account closed account wrote chase executive office asked detail name affiliate either closed account told would provide information,credit_card,high
well fargo visa repeated occasion least four last several week attempted get copy monthly statement statement available online well fargo promised mail statement fax never arrive time say give day arrive via fax arrive even tried working local well fargo branch called behalf even provided fax number credit card department also avail thank help provide run option try work get u information requested,credit_card,low
purchased order amount credit card statement show spoken stated havent sent proper information charge wrong amount since,credit_card,low
currently credit card cpaitalone via walmart card year able use card past year contacted capitalone asked license due assuming fact gotten married time tried send via phone didnt work sent mail twice three time time call back waiting week get release card suspeneded account spent hour phone trying get resolved tried hour also talking representative able sign onto account via web pay bill getting nowhere keep getting send information able read back license sorry know looking short going nothing else informed today received info unable read unfair something new card year,credit_card,low
made purchase best buy never received statement went best buy inquire balance pay unfortunately closed indefinitely due tried navigate computer system denied called stuck phone system going around circle finally received statement received late course best buy citibank feel pay close late fee ive called several time explaining unwilling accept original payment due completely unfair,credit_card,medium
department sent money program usreliacard usreliacard program florida money since total amount card blocked http usbank reliacard cardholder service florida united state phone reliacard issued bank national association pursuant license mastercard registered trademark circle design trademark card would activate wait second card usually take business day card arrive told needed fax copy driver license bill provided full ssn number would take hour activated faxed document several time availed access fund family homeless one child back bill company know care already filed several complaint many manager care even one named laughing situation please something,credit_card,low
usaa failed credit account amount credit card ending original purchase merchandise amount per attached receipt dated amount return merchandise per attached receipt dated purchase return amount liability purchase return posted usaa posted credit amount merchandise return however usaa reversed credit amount issue remains proof return refund attached receipt refund account still due credit amount,credit_card,low
may concern charge debit card recognize tried calling company unable connect get review debit card statement fee charge need get statement thank,credit_card,low
several year ago took dollar cash advance loan jcpenny credit card called make full payment cash advance balance told possible pay amount option payoff entire credit card several year since took cash advanced loan balance drop insignificantly continues accrued interest,credit_card,low
reporting fraud government credit card account hacked different cash withdrawal totaling made dispute direct express company regarding fraud card took information said investigation almost month since happened act like care hard reach customer service took also made police report told fraud told contact de dragging foot care please help get money back thank much,credit_card,low
balance use card last week seeing minimum due month purchase balance made appeared statement date would payment due date made purchase week payed change today see account note saying need pay barclays money put account past due status account past due status owe nothing account paid balance took screenshot need owe nothing want report possibly others think barclays running scam credit bureau ruin people credit delicate time people credit report ruin see way since pandemic contacting agency report unfair practice never really major problem pandemic way thinking target payment scheme every time call phone line go dead number stored system recognize number guessing reason system blocking call getting patched speak anybody,credit_card,low
please see attached detailed account experienced amex forced arbitration time via messaging please check record also subpoenaing obtain information requested record chat received writing comment nutshell amex credit score keep repeatedly forcing pay money due wont approve purchase need make pay done three month row fact homeless small miracle honestly testament strong support system friend family member could asked amazing base needed everything amex put genius literally amex way instead contributing science helping humanity dead jail homeless specifically action get lucky happening people life willing support would happened question fact happened three month row incredibly criminal violation sec ethic international banking regulation feel purposeful negligence know wronged also know still precarious position better way get rid potential lawsuit bankrupting prosecution illegibly forcing insolvency currently happening despite best attempt wealthier ever please see attached using newfound wealth make sure amex see repercussion going allocate pay student loan however wait better use money,credit_card,high
accepted mo promo offer unknowingly forfeited grace period new purchase make new purchase charged fee renewal charged current finance charge immediately charge hit card matter pay statement balance full month charged day charge grace period seems like scam aware card promos still retain grace period charged interest pay minimum amount due month new charge incurred thankfully fund pay entire balance full saving immediately stopped using card seems like unfair business practice really immediately charged extremely high interest rate new purchase,credit_card,low
keep getting fraudalent transaction account try dispute transaction getting put hold hour call drop start whole process really spent yesterday never talked anyone phone help dispute,credit_card,low
purchased airline ticket foreign airline name flight scheduled depart received short notice flight canceled voucher issued could exchanged another flight within year expiration airline announced would longer fly usa making using alleged voucher impossible since must fly usa destination month customer care stopped taking call way reach attempted call multiple time learn redeem alleged voucher showing account several attempt reach filed dispute apple card shortly decided close claim favor airline stating merchant told provided credit voucher went explain voucher account operating anymore apple card rep help said unless new evidence nothing could done infuriated robbed almost company presumably helping siding merchant dishonest month passed airline website longer existence customer care number service publicized airline even paid worker shared apple card representative gave ridiculous response new evidence airline thousand hundred upon hundred complaint practice company promised back done frustrating middle pandemic job steady income make sick stomach deeply disappointed apple card heavily promoted product service everyone know converting competitor failed agree merchant provided solution website phone number airline even operating attached screenshots ongoing issue hope find someone help next step contacting medium shine light issue,credit_card,low
disappointed lowe synchrony bank every time get promotion like join purchase one statement matter amount date year today checking statement notice interest charge called customer service said interest charge unless pay late went time end call went back statement went see second page noticed really charging interest one account called back another member answer explained asked whey charging interest statement always pay time pay minimum payment pay late fee interest astonished said called recorded requested change one special promotion regular charge interest upset told need recorded request need speak supervisor transferred supervisor explained said put hold came back told mistake could give credit interest taking every month promotion account long time charging told right fault said felt sorry nothing could asked nothing said well give last two month told taking every month repeated sorry nothing first time mistake customer pay mistake bad know going use credit card thing lowe give support customer kind situation also called lowe said nothing need fix synchrony bank bank locate number put complain hey request synchrony band ask customer get contact synchrony bank put complain saw lot people put complain resolution bank,credit_card,medium
booked flight using chase credit card reward point received notification booked flight cancelled rebooked confirmation flight pm flight also cancelled submitted refund request responded following day informing submit request travel agency chase reward booked flight reached chase informed able issue airline credit chase informed wanted cash refund reach directly however since flight cancelled wanted full return chase credit card point want travel credit submitted u dot complaint regarding credit card reward point refund process received response talk travel agency want full refund point problem ask chase full point refund refer reach refer back chase,credit_card,low
noticed credit card opened closed name credit report disputed said accurate left credit score company involved contact account every time try call automated system ask information account small charge hurting credit score account unpaid set never received call email letter letting know delinquent would like account removed please company involved account number report account opened closed according account charged number appreciate help give best,credit_card,low
applied credit card flight application handed filled application handed back attendant placed seat watched remind since application date heard anything called customer service text instruction call b customer service called b spoke alerted application record concerned personal info belief attendant mishandled application misplaced lost anyone get seems like severe breach security flight departing would like take action protect account,credit_card,low
ive trying get contact someone helping collect unemployment fund prepaid card sent ive told need verify im confused everything needed still havent received anything,credit_card,low
contacted comenity regarding credit card payment late advised financial hardship due covid requested payment relief assistance program representative offered payment extension would notated account hardship still possibly make subject late fee declined requested specifically covid hardship representative rudely asked would able come minimum payment another month requested transferred immediately afterward still annoyed could bare speak another rep also gone several issue getting first online order placed rep kept making mistake kept call back instead sent online message advising issue dissatisfaction requested small courtesy refunded late fee finance charge paid card full minus amount late fee finance charge rather accept covid hardship possibly deal people responded agreement refund late fee finance charge amount finance fee realize difference requested remainder finance charge also refunded continued disappointment customer service received response stating would refunding remaining charge,credit_card,medium
wisconsin eppicard child support card closed without prior warning since since could use child support card keep calling calling eppicard customer service wisconsin child support local county child support agency one issue new card except eppicard answer matter long sit hold account closed even automated service hang,credit_card,low
opened business account b used card time total recently closed account explanation,credit_card,low
