narrative,product,risk_label
debt verification letter mailed jefferson capital system via certified mail monday received letter jefferson capital dated postmark letter letter state puchased debt question verification enclosed enclosure photocopy bill original creditor dated information received jefferson capital enough verify alleged debt failed provide information requested debt verification letter date debt purchased addition account reported opened two year past date photocopy bill provided believe debt age incorrectly reported bureau violation fcra recently unaware said alleged debt jefferson capital system failed provide adequate documentation justify collection effort,debt_collection,low
received letter firstmark service division nelnet asserting owe student loan originated letter state want month month last payment amount due account number listed letter note id opening reading referenced attached letter called firstmark service discus matter spoke representative name explained loan referenced state attached letter firstmark service reported credit report attached since paid shown balance asked account reported paid closed balance sudden turn bill referenced attached herein transferred supervisor whose name conversation asked informed system firstmark show balance status payment indicated letter firstmark dated attached referenced told printout credit report dating back many year report informed firstmark even appear three bureau went state credit report firstmark first appears show account closed stated continuing date firstmark account number referenced referenced attached aforementioned letter firstmark dated show account status closed account balance asked sudden owe account reported closed balance three year stated wanted send copy credit report referenced firstmark would happy review reach original lender see need update record suppress account informed attorney retained would discus letter phone call offered give name information indicate account attorney name information said would take information phone fill release authorization form would email firstmark would able speak attorney regarding matter receive form since completed emailed firstmark service form also attached herein copy form others furnished attorney wi conversation firstmark researched credit report attached herein analyzed situation synopsis genesis evolution matter follows acc originated month year firstmark claim originated therefore logical conclude firstmark claiming collecting behalf account referenced per record account reported balance status payment history firstmark never report business relationship knowledge entity name firstmark time credit report attached show acc closed debt included discharged bankruptcy ch show acc closed balance firstmark show credit report first time report attached date reflect account closed show balance reported attached report reflects firstmark account closed balance credit report attached show firstmark account closed balance three bureau pulled three bureau report separately attached complaint three bureau report dated firstmark acc show closed balance acc continually show closed status balance current day appears firstmark acquired alleged debt sometime still credit report first appears never received communication firstmark letter referenced beginning communication consumer financial protection act enforced consumer financial protection bureau cfpb typically brings enforcement action combination applicable federal consumer protection statute listed consumer financial protection act cfpa cfpas prohibition unfair deceptive act practice udaap chief enforcement mechanism revised education loan exam procedure cfpb explains examiner review student loan servicers compliance federal consumer financial law cfpb listed following potentially unfair deceptive abusive act practice respect lender servicers interaction consumer act practice deceptive cfpa representation omission likely mislead consumer acting reasonably circumstance representation omission material act practice unfair cause likely cause substantial injury consumer consumer reasonably avoid injury injury outweighed countervailing benefit consumer competition abusive act practice one materially interferes consumer ability understand term condition consumer financial product service take unreasonable advantage consumer lack understanding material risk cost condition product service b consumer inability protect interest selecting using consumer financial product service c consumer reasonably relies covered person act consumer interest assert reporting account closed balance current day stating open balance deceptive assert reporting account closed balance current day stating open balance unfair cause substantial harm consumer could prepared debt paid reported balance three year assert reporting account closed balance current day stating open balance abusive act practice firstmarks reporting clearly state alleged debt paid closed balance try history state alleged debt anything reported materially interferes consumer ability understand term condition alleged debt based upon firstmark must correct system reflect information reported since thereby listing alleged debt paid closed balance,debt_collection,high
respectfully ask cfpb supervise dispute debt collector received letter bernhardt strawer regarding alleged debt response sent certified letter stating agreement would considered position stated clearly previous communication alleged client however presented position manner requested evidence bernhardt strawser legal standing collect alleged debt letter dated failed comply request instead sent unauthenticated computerized copied billing statement along generic term condition sent another certified letter advising claim would considered cant demand monies alleged debt proof ownership verified exhibited response bernhardt strawer sent another letter dated information letter along unauthenticated computerized copied billing statement generic term condition,debt_collection,low
creditor coll svc posted unknown medical bill credit report time medical fee well dollar open balance posted balance since resolved,debt_collection,low
apartment complex saying owe money owe nothing contacted collection company asking validate debt sent proof stayed proof owe anything,debt_collection,low
filing complaint sequium asset solution llc made multiple attempt rectify account well request debt validation company made attempt provide validity debt requested contract stating amount owed well surety fact reasonable investigation company failed respond request request delivered company day since company yet respond account sequium original creditor account number,debt_collection,medium
fma alliance sent vague letter trying collect account number ending debt account number ending discharged nearly year ago bankruptcy discharge info fma alliance ample notice valid debt trying collect either careless shady business practice cause unnecessary stress victim waste everyone time allowed fma alliance punished making collection claim bankruptcy discharge united state bankruptcy court california case number order discharge chapter ordered discharge granted debtor discharge date dated court united state bankruptcy judge,debt_collection,high
tuesday starting eastern standard time received call conns collect payment due feel extremely harassed appalled time crisis country economy would considered acceptable considering legal action attorney feel harassed willing see resolution company make determination,debt_collection,high
back earlier covered insurance couple year later see collection credit report notification disputed removed year later came back never received notice kind rash curtis regard debt removed dispute feel came back report rash curtis associate really bad reputation falsifying debt,debt_collection,low
reviewing account seen cbe group collection inserted credit report never received information bill never chance dispute information impacted credit report score happy sue n violation right causing issue please provide validation debt method verification account make sense company allowed effect negative way idea account came date even make sense opened opened sound little backwards,debt_collection,low
remember account asked multiple time send proof ownership complied request yet,debt_collection,low
wife decided switch service spotty overseas make switch pay phone contract sends email asking u return promising monetary compensation returning continues send u bill even though remind time paid phone full paid final bill informed sent bill collection diversified adjustment service contact u explain bill never sent collection evidence begin dispute process credit bureau investigated deleted account credit report investigated delete account credit report instructed contact cfpb evidence investigated deleted account credit report diversified adjustment service contact u explain disputed account successfully gotten removed report keep working get removed third diversified adjustment service threatens u keep shopping around debt keep reporting credit bureau dont pay contract end began process switching reserve continue serve country required hold secret security clearance account collection threatens clearance concerned able provide family false debt received another collection attempt different company called lead believe diversified adjustment service followed threat,debt_collection,low
dear cfpb please find complaint sham conduit concealed owner reinstated different name via fictitious buyer default debt sell investor bet image someone data identity theft submitted application mortgage posed lender never lender passed information via dishpan intermediary actual originator big investment bank particularly one owner federal reserve bank actual lender behind scene along big bank read federal reserve operates ponzi scheme derivative via big bank version fictitious mortgagee application processed owned owned instantly fraudulently placed undue hardship intentionally assigning property flood zone never result machination pay additional fema allowed use form defraud borrower solely extort money push foreclosure fema agreed refund part stolen money pocketed rest least plus proceeds trade identity undisclosed time posed lender forged respa document conceal information actually singed disclosure pacific time zone cloud server owned closing believed mortgage aka payment financial service pier operate separate securitization scheme based data mortgage conducted falsely posed issuer lie sham conduit actual issuer bog title insurance policy cover purported mortgage designated lender branch actual originator servicers loan intentionally destroy property title serve interest wall street bank deceptively sold title insurance policy actual issuer refuse cover damage broken subsidiary pretend dont know fraud also refuse fulfill obligation policy lied issued continued act lender purported servicer loan led believe sold someone appointed new servicer lie never lent money anyone never serviced loan need say never sold loan anyone never purchased anyones loan never pooled trust fiction promoted medium defraud borrower investor according fully based forward looking statement never say following guaranteed stripped security sold time time one series represent interest separate established time trust comprised primarily fully modified certificate series issued two class class security series evidence interest future principal payment interest future interest payment trust asset included related trust trust created issue classified grantor trust issued maintained form system federal reserve bank system initially registered name federal reserve bank new york together successor depository selected depository system electronic facility operated federal reserve bank maintaining security account effecting transfer system gross settlement system allows simultaneous transfer security payment system used clear settle pay also treasury marketable debt instrument majority security issued government agency government sponsored enterprise security issued mortgage ownership subject rule procedure governing participant effect time time maintain evidence interest participant appropriate entry book record participant eligible maintain bookentry account directly beneficial owner participant system generally evidence interest appropriate entry book record one financial intermediary beneficial owner must rely upon procedure evidence beneficial ownership may transfer beneficial ownership complies procedure appropriate financial intermediary correspondingly beneficial owner must depend upon financial intermediary including depository holder enforce right respect issued certificated form unless otherwise noted applicable offering circular supplement trust issue word perform something someone sell mortgage never happened people still dont believe loan securitized treated though securitized securitization mean selling asset pro rata share investor get piece paper telling x asset read prospectus securitization document forward statement meaning referencing future event none securitization document convey ownership equitable legal interest debt note mortgage future event never occurs thats point banker since never retain interest debt note mortgage face exposure risk loss liability violation federal state statute issuer lender even though foreclose various intermediary usually bank appearing solely trustee nonexistent trust still receive net money proceeds loan account receivable credit receive sale proceeds soon signed promissory note scanned converted image passed member federal reserve placed image personal data placed provide password various sham conduit like later fake servicer whose sole duty pose window dresser federal reserve member actual player operate giant scam image based bet performance someone data mortgage mi invested pensioner money fraud received electronic image someone computer screen performance someone loan sold performing defaulted time different player mortgage payment along escrow money pocketed broker revenue since one loan asset account receivable tax insurance paid investor money operating fund held federal reserve bank similarly fake servicers make servicers advance trust big bank merely return investor part capital masqueraded servicer advance ponzi scheme finest according became lie prepared allonge note purportedly never placed account time question data loan held transferred various party multiply time without disclosure approached another branch action branch whose founder pretended new servicer buyer loan asked sold loan sold exploded absurd contradicting lie requested help sen senior vp seasoned security fraudster whose cevy chase robbed insurer investor lied backed loan lied refuse provide name seller loan lied hold loan security ever formed securitization loan never happened mean claim right authority administer collect enforce debt note mortgage completely utterly false based upon securitization subject loan like gses merely agreed cover federal reserve owner well fargo etc crime pr machine convinced virtually everyone including borrower loan securitized hundred appellate decision referring loan portfolio exist treated real nonetheless bulletin announcement phrased order avoid indictment civil liability outright lying investor public referring loan portfolio reference pool never formed since nobody sold loan everything done party big bank aka federal reserve branch never appeared respa tile must kept hidden homeowner investor even allowed proof investment investor pay image someone computer screen regarding state issued form class series certificate initially issued facility global security representing certificate transferred except whole nominee nominee another nominee thus nominee registered holder certificate considered sole representative beneficial owner certificate word may distribute beneficial ownership beneficial owner case direct indirect participant completely managed controlled regulated benefit neither never owned anyones debt simply nobody allow never initiated loan dont money loan never serviced mortgage since big bank well aware executive merely foreclosure title laundering vehicle big federal reserve whose sole purpose pretend buyer read passed data loan new player via new password database relentlessly lie borrower massively commit fraud upon court promoted enabled judge government course familiar crime exactly operates federal reserve member via branch initiate illegal foreclosure trust forged document according also known specialist united state financial institution process transfer stock certificate behalf central security depository used united state includes new york exchange together associated clearinghouses others technically owns substantially publicly issued stock united state thus investor hold direct property right stock rather contractual right part chain contractual right involving formed purpose efficiently processing transfer stock certificate behalf company new york new york partnership certain employee yes security created issued sold traded fact indenture indeed reference group data derived announcement investment bank referring performance loan securitization loan securitization proprietary data relating performance loan ownership loan required speak securitization loan loan go could reasonable basis dispute whether loan extinguished simply became inchoate sleeping pending reformation transaction designated virtual creditor replaced real one required law doesnt give unfair windfall homeowner reneged promise pay absolutely fact reveals exactly opposite lender security brokerage firm business investment bank actually issuer security sold without cooperative signature homeowner together detailed personal information homeowner resulting sale security produce windfall investment bank equal average time time time principal paid thus far homeowner word owns received least revenue trade data loan merely contributed one time payment bear risk transaction received least time profit trading date loan time homeowner required disclosed part deal repay principal paid mean homeowner receive consideration concealed part securitization deal addition homeowner unknowingly taken risk investment bank dumped putative lender really sole business reason transaction issuance security without would near lending individual homeowner security merrier larger windfall investment bank without giving conveyance debt note mortgage never see investment bank grantee recorded conveyance since investment bank risk loss care future performance alleged loan transaction one fact remove basic balance person characterized borrower person characterized lender according federal state lending law basic common sense lender sophisticated financial enterprise charged legally determining viability loan risk loss without risk loss interest remaining getting borrower submit personal data homeowner sign documentation promising pay back consideration plus interest received concealed involuntary participation securitization scheme contract law classic example failure element enforceable contract meeting mind borrower intent lending intent contract homeowner deprived opportunity receive benefit bargaining share securitization scheme participate therefore conclusion homeowner owes nothing contract failure b entitled quantum meruit law reasonable compensation concealed securitization scheme could never existed homeowner signature personal data mean mean none investor bought traded swap certificate security ever acquired interest loan none acquired ownership debt note mortgage none ever acquired legal right administer collect enforce debt note mortgage mean document suggesting contrary fabricated false thus circumstance servicer trustee trust investor including possesses right title interest administration collection enforcement loan dump risk theory behind securitization perfectly sound legal moral politically expedient intended attract investment reducing risk took one step completely eliminated risk order completely eliminate loan account general ledger company involved securitization process loan account cover fraud doesnt exist nobody loses money homeowner stop paying homeowner pay contributing bonus largely untaxed profit investment bank apt description happens money homestead forced sale entry ever made decreasing amount receivable receivable part completely counterintuitive nearly everyone also reason foreclosure consistently attempt get discovery information would obviously lead admissible evidence court thousand foreclosure case pushed back burner year one year old result lawyer pro se litigant experimenting concept concept simple claim brought homeowner either directly indirectly asserts designated claimant exists real world possesses claim homeowner homeowner say ok tell exist acquired claim foreclosure mail refuse answer know truth kill claim sheer force perseverance infinitely deep pocket investment bank continues litigating claim absolutely merit case government regulator sleeping cost defending baseless claim fall onto homeowner lack resource time money energy preserve largest asset owns demand full disclosure serviced real lender behind transaction based evidence federal reserve table pool operated owner demand compensation fraud royalty trade punitive damage least,debt_collection,high
good evening account continues report inaccurate incomplete unverifiable information lawsuit bank loan deceptive santander reach settlement state alleged deceptive auto loan practice state including connecticut california florida new jersey new york pennsylvania reached settlement automotive financing company santander consumer usa reimburse consumer alleged deceptive loan practice disputed account several time asking several type document included pursuant federal statutory law regard repossession vehicle shocked reviewed credit report week found multiple inaccuracy credit report major credit bureau yet stated verified account accurate impossible im really worried information credit report account may reporting inaccurately understand must procedure place respond question credit reporting look like detail guy reporting arent true example account type show auto loan thought correct term alleged account credit sale anyway please help understand whats going id like see following document compare information credit report would appreciate thoughtful response office please dont send unintelligible response doesnt address concern here id like see complete original alleged promissory note show signature account transaction history required default acceleration notice notice sale document calculation surplus deficiency letter additional finance contract including related insurance finance product buyer guide purchase order license bond registration document required state allows hold service alleged promissory note thanks prompt attention concern,debt_collection,high
received telephone call company claiming collecting debt owed behalf told caller believed information incorrect would contact caller tried stop stating would work etc basically cut said contact hung call account fund available account information seemed wrong called reported call representative confirmed owed debt checked active account general search using name told involved collection attempt received written request settle false debt company called american cordius international llc copy written request company upload reporting false debt collection attempt simultaneously sending registered letter company informing debt false contact,debt_collection,low
rented paid monthly quarterly payment sufficient timely manner auto pay auto pay online banking reason hickup colllecting missed month two caught around payment hit late fee questioned resolved shortly thereafter time renewed lease machine asked assured account date paid full continued rental program every year one day asked return machine owed money surprised confused people said terminated contract account returned machine credit collection agency started hounding never problem person asked prove payment would resolve account sent evidence said contract owed recall forced return machine threat something used tone abusive ruin credit possibly place judgement tantamount consumer fraud please help,debt_collection,medium
bought furniture paying fine till grand daughter diagnosis financing went drain tried tell back foot willing pay full amount pay deletion willing get hardship letter order delete refusing,debt_collection,low
credence rm claiming owe recognize debt please remove inaccurate collection report,debt_collection,low
attended washington dc friend left wallet car taking main cash cell phone returned car window smashed several item including wallet stolen following day resulted dollar spent random md several online order thes purchase made credit card quickly canceled replaced week later get bill medical procedure affirm result theft day go someone mistake someone else would assume generic face used identity theft scam someone could tend health related successfully disputed credit report year year keep popping citing debt sold another collection company please assist acquiring notice block reappearing deemed fraud thank,debt_collection,high
